Orthogroup	Hsap	Acer
OG0000002	ZN833_HUMAN, ZN214_HUMAN, ZN229_HUMAN, ZN227_HUMAN, ZN226_HUMAN, ZN234_HUMAN, ZN221_HUMAN, ZN225_HUMAN, ZN224_HUMAN, ZN284_HUMAN, ZN155_HUMAN, ZN230_HUMAN, ZN222_HUMAN, ZN223_HUMAN, ZN233_HUMAN, ZN235_HUMAN, ZNF45_HUMAN, ZN112_HUMAN, ZN285_HUMAN, ZN624_HUMAN, Z354A_HUMAN, Z354B_HUMAN, ZN879_HUMAN, ZN620_HUMAN, Z354C_HUMAN, ZNF74_HUMAN, ZN391_HUMAN, ZN892_HUMAN, ZN251_HUMAN, ZNF7_HUMAN, ZN485_HUMAN, ZN502_HUMAN, ZN184_HUMAN, ZN454_HUMAN, ZN550_HUMAN, ZN460_HUMAN, ZN543_HUMAN, ZN264_HUMAN, ZN805_HUMAN, ZN599_HUMAN, Z286A_HUMAN, Z286B_HUMAN, ZN840_HUMAN, ZN667_HUMAN, ZN527_HUMAN, ZN470_HUMAN, ZN471_HUMAN, ZFP28_HUMAN, ZN570_HUMAN, ZN583_HUMAN, ZN383_HUMAN, ZN829_HUMAN, ZN566_HUMAN, ZN582_HUMAN, ZN345_HUMAN, ZN850_HUMAN, ZN283_HUMAN, ZN331_HUMAN, ZN573_HUMAN, ZNF30_HUMAN, ZN607_HUMAN, ZFP14_HUMAN, ZFP82_HUMAN, ZFP30_HUMAN, ZN540_HUMAN, Z780A_HUMAN, Z780B_HUMAN, ZN404_HUMAN, ZN546_HUMAN, ZN461_HUMAN, ZN529_HUMAN, ZN790_HUMAN, ZN420_HUMAN, ZN565_HUMAN, ZN571_HUMAN, ZN181_HUMAN, ZN302_HUMAN, ZN140_HUMAN, ZNF80_HUMAN, ZN684_HUMAN, Z585A_HUMAN, Z585B_HUMAN, Z658B_HUMAN, ZN658_HUMAN, ZFP1_HUMAN, ZN248_HUMAN, ZN334_HUMAN, ZN37A_HUMAN, ZN33A_HUMAN, ZN33B_HUMAN, ZN510_HUMAN, ZNF25_HUMAN, RBAK_HUMAN, ZNF12_HUMAN, ZN567_HUMAN, ZN382_HUMAN, ZN782_HUMAN, ZN487_HUMAN, ZN157_HUMAN, ZN717_HUMAN, KRBD4_HUMAN, ZN674_HUMAN, ZN793_HUMAN, ZN577_HUMAN, ZN484_HUMAN, ZNF41_HUMAN, ZN175_HUMAN, ZNF81_HUMAN, ZN268_HUMAN, ZNF26_HUMAN, ZN605_HUMAN, ZNF84_HUMAN, ZN432_HUMAN, ZN615_HUMAN, ZN614_HUMAN, ZN613_HUMAN, ZN350_HUMAN, ZN649_HUMAN, ZN133_HUMAN, ZN169_HUMAN, ZN875_HUMAN, ZN337_HUMAN, ZN343_HUMAN, ZN589_HUMAN, ZN300_HUMAN, ZN630_HUMAN, ZN182_HUMAN, ZIM3_HUMAN, ZN569_HUMAN, ZN568_HUMAN, ZN317_HUMAN, ZN177_HUMAN, ZN846_HUMAN, ZN561_HUMAN, ZN562_HUMAN, ZN426_HUMAN, ZN121_HUMAN, ZN778_HUMAN, ZN560_HUMAN, ZN266_HUMAN, ZN559_HUMAN, ZN557_HUMAN, ZN558_HUMAN, ZN596_HUMAN, Z705E_HUMAN, Z705A_HUMAN, Z705G_HUMAN, Z705B_HUMAN, Z705D_HUMAN, ZN554_HUMAN, ZN891_HUMAN, ZN180_HUMAN, ZN544_HUMAN, ZNF10_HUMAN, ZN606_HUMAN, ZFP90_HUMAN, ZN542_HUMAN, ZN789_HUMAN, ZF69B_HUMAN, ZFP69_HUMAN, ZN713_HUMAN, ZN75A_HUMAN, ZNF8_HUMAN, ZN333_HUMAN, ZN514_HUMAN, ZN135_HUMAN	KAK2561211.1
OG0000045	K1C18_HUMAN, K1C20_HUMAN, K1C17_HUMAN, K1C14_HUMAN, K1C16_HUMAN, K1C12_HUMAN, K1C24_HUMAN, K1C26_HUMAN, K1C28_HUMAN, K1C25_HUMAN, K1C27_HUMAN, K1C9_HUMAN, K1C10_HUMAN, K1C19_HUMAN, K1C13_HUMAN, K1C15_HUMAN, KRT36_HUMAN, KRT35_HUMAN, K1H2_HUMAN, K1C39_HUMAN, K1C40_HUMAN, KRT37_HUMAN, KRT38_HUMAN, KRT34_HUMAN, K1H1_HUMAN, KT33A_HUMAN, KT33B_HUMAN	KAK2547790.1
OG0000048	CLCC1_HUMAN	KAK2553794.1, KAK2553870.1, KAK2553874.1, KAK2570675.1, KAK2570678.1, KAK2570677.1, KAK2570679.1, KAK2555884.1, KAK2556061.1, KAK2550587.1, KAK2549765.1, KAK2552447.1, KAK2556996.1, KAK2571671.1, KAK2549625.1, KAK2569010.1, KAK2555819.1, KAK2549886.1, KAK2549887.1, KAK2557388.1, KAK2548569.1, KAK2559493.1, KAK2552767.1, KAK2558661.1, KAK2559726.1, KAK2561634.1, KAK2572715.1, KAK2547649.1, KAK2549069.1, KAK2555920.1, KAK2548724.1, KAK2558766.1, KAK2567026.1, KAK2556059.1, KAK2574045.1, KAK2560639.1, KAK2557418.1, KAK2561679.1, KAK2561978.1, KAK2563788.1, KAK2567908.1, KAK2551618.1, KAK2559366.1, KAK2552190.1, KAK2565063.1, KAK2558610.1, KAK2547883.1, KAK2552956.1, KAK2563765.1
OG0000053	ACH10_HUMAN, ACHA9_HUMAN, ACHB2_HUMAN, ACHB4_HUMAN, ACHA3_HUMAN, ACHA6_HUMAN, ACHA4_HUMAN, ACHA2_HUMAN, ACHA5_HUMAN, ACHB3_HUMAN, ACHA7_HUMAN, CRFM7_HUMAN	KAK2547199.1, KAK2548628.1, KAK2565069.1, KAK2571926.1, KAK2572642.1, KAK2571002.1, KAK2570908.1, KAK2570907.1, KAK2572955.1, KAK2572954.1, KAK2552870.1
OG0000013	CTRL_HUMAN, CTRB1_HUMAN, CTRB2_HUMAN, KLK7_HUMAN, KLK14_HUMAN, KLK5_HUMAN, KLK4_HUMAN, KLK15_HUMAN, KLK8_HUMAN, KLK10_HUMAN, KLK12_HUMAN, KLK13_HUMAN, KLK6_HUMAN, KLK9_HUMAN, KLK11_HUMAN, TRY1_HUMAN, TRY2_HUMAN, TRY6_HUMAN, TRY3_HUMAN, TMPS9_HUMAN, TEST_HUMAN, PRS41_HUMAN, PRS33_HUMAN, BSSP4_HUMAN, PRS27_HUMAN, TRYD_HUMAN, TRYB1_HUMAN, TRYB2_HUMAN, PRS29_HUMAN, PRS38_HUMAN	KAK2573735.1, KAK2553845.1, KAK2570101.1, KAK2565368.1, KAK2568182.1, KAK2568184.1, KAK2559376.1, KAK2565258.1, KAK2558430.1, KAK2559309.1, KAK2559444.1, KAK2572836.1, KAK2572356.1, KAK2554716.1
OG0000000	CE290_HUMAN	KAK2555414.1, KAK2549296.1, KAK2562736.1, KAK2565661.1, KAK2548275.1, KAK2551943.1, KAK2555389.1, KAK2551090.1, KAK2551944.1, KAK2549263.1, KAK2571587.1, KAK2551946.1, KAK2551086.1, KAK2551592.1, KAK2551544.1, KAK2551591.1, KAK2552803.1, KAK2553065.1, KAK2564450.1, KAK2553066.1, KAK2548210.1, KAK2570470.1, KAK2559240.1, KAK2555355.1, KAK2560659.1, KAK2574504.1, KAK2564249.1, KAK2558945.1, KAK2555736.1, KAK2555240.1, KAK2571162.1, KAK2564211.1, KAK2571672.1, KAK2547440.1, KAK2551962.1, KAK2552743.1, KAK2549843.1, KAK2554049.1, KAK2560970.1, KAK2561756.1, KAK2564074.1, KAK2568012.1, KAK2549083.1, KAK2564647.1, KAK2553645.1, KAK2558854.1, KAK2547269.1, KAK2556999.1, KAK2548062.1, KAK2547271.1, KAK2548065.1, KAK2558779.1, KAK2549338.1, KAK2552773.1, KAK2549330.1, KAK2572925.1, KAK2549339.1, KAK2564352.1, KAK2558624.1, KAK2558892.1, KAK2552807.1, KAK2547504.1, KAK2552366.1, KAK2546807.1, KAK2557513.1, KAK2559811.1, KAK2551372.1, KAK2548274.1, KAK2564674.1, KAK2566453.1, KAK2550689.1, KAK2564666.1, KAK2551371.1, KAK2559286.1, KAK2559407.1, KAK2556964.1, KAK2551963.1, KAK2550393.1, KAK2563193.1, KAK2561528.1, KAK2563196.1, KAK2559274.1, KAK2560089.1, KAK2550695.1, KAK2563195.1, KAK2561453.1, KAK2572805.1, KAK2546690.1, KAK2572917.1, KAK2546691.1, KAK2550140.1, KAK2559406.1, KAK2556429.1, KAK2557299.1, KAK2562403.1, KAK2552837.1, KAK2563948.1, KAK2553646.1, KAK2548231.1, KAK2554083.1, KAK2560684.1, KAK2553710.1, KAK2549376.1, KAK2560968.1, KAK2556014.1, KAK2559080.1, KAK2556015.1, KAK2560969.1, KAK2568011.1, KAK2555682.1, KAK2571014.1, KAK2559471.1, KAK2569731.1, KAK2556972.1, KAK2567036.1, KAK2546643.1, KAK2571020.1, KAK2559389.1, KAK2551281.1, KAK2548899.1, KAK2551276.1, KAK2571021.1, KAK2567037.1, KAK2548898.1, KAK2569730.1, KAK2559388.1, KAK2549299.1, KAK2548232.1, KAK2559468.1, KAK2556971.1, KAK2565870.1, KAK2551172.1, KAK2572931.1, KAK2551174.1, KAK2568472.1, KAK2560410.1, KAK2555311.1, KAK2562770.1, KAK2547470.1, KAK2548196.1, KAK2562243.1, KAK2564565.1, KAK2564559.1, KAK2549278.1, KAK2551629.1, KAK2549279.1, KAK2550413.1, KAK2560812.1, KAK2558891.1, KAK2551984.1, KAK2556969.1, KAK2558647.1, KAK2568584.1, KAK2552136.1, KAK2564054.1, KAK2547894.1, KAK2558534.1, KAK2547120.1, KAK2552409.1, KAK2546744.1, KAK2551635.1, KAK2551939.1, KAK2562729.1, KAK2555847.1, KAK2560823.1, KAK2546618.1, KAK2572293.1, KAK2566307.1, KAK2547003.1, KAK2560645.1, KAK2553368.1, KAK2573522.1, KAK2568332.1, KAK2554755.1, KAK2557501.1, KAK2572193.1, KAK2551482.1, KAK2556169.1, KAK2547002.1, KAK2554758.1, KAK2546619.1, KAK2566374.1, KAK2551481.1, KAK2549464.1, KAK2551360.1, KAK2557507.1, KAK2571539.1, KAK2571538.1, KAK2559519.1, KAK2548212.1, KAK2570905.1, KAK2547184.1, KAK2553629.1, KAK2551361.1, KAK2549265.1, KAK2571265.1, KAK2560822.1, KAK2573521.1, KAK2569319.1, KAK2553369.1, KAK2572294.1, KAK2568331.1, KAK2570013.1, KAK2553631.1, KAK2564578.1, KAK2548059.1, KAK2555791.1, KAK2568972.1, KAK2562703.1, KAK2550655.1, KAK2555250.1, KAK2559030.1, KAK2559566.1, KAK2555141.1, KAK2552231.1, KAK2555768.1, KAK2572169.1, KAK2565660.1, KAK2565659.1, KAK2549342.1, KAK2566432.1, KAK2564155.1, KAK2553064.1, KAK2556043.1, KAK2550594.1, KAK2559023.1, KAK2562809.1, KAK2565115.1, KAK2551494.1, KAK2565830.1, KAK2567813.1, KAK2568064.1, KAK2558216.1, KAK2565724.1, KAK2563558.1, KAK2562998.1, KAK2572772.1
OG0000058	ANKR7_HUMAN, ANR62_HUMAN, A26L1_HUMAN, AN36C_HUMAN, AN36A_HUMAN, AN36B_HUMAN, A30BL_HUMAN, AN30A_HUMAN, AN30B_HUMAN, ANR19_HUMAN, AN18A_HUMAN, AN18B_HUMAN, A2012_HUMAN, AN20B_HUMAN, A20A5_HUMAN, A20A4_HUMAN, A20A2_HUMAN, A20A1_HUMAN, A20A3_HUMAN, AR26L_HUMAN, POTEA_HUMAN, POTB2_HUMAN, POTEB_HUMAN, POTB3_HUMAN, POTEC_HUMAN, POTED_HUMAN, POTEH_HUMAN, POTEG_HUMAN, POTEM_HUMAN, POTEI_HUMAN, POTEJ_HUMAN, POTEE_HUMAN, POTEF_HUMAN, C144B_HUMAN, C144C_HUMAN, C144L_HUMAN, C144A_HUMAN, ANR26_HUMAN	KAK2555581.1, KAK2555580.1
OG0000006	STPG1_HUMAN	KAK2556282.1, KAK2561416.1, KAK2554961.1, KAK2553019.1, KAK2547337.1, KAK2564584.1, KAK2551980.1, KAK2567974.1, KAK2552037.1, KAK2561867.1, KAK2573321.1, KAK2559177.1, KAK2550455.1, KAK2549595.1, KAK2550096.1, KAK2571394.1, KAK2550180.1, KAK2555878.1, KAK2552223.1, KAK2562748.1, KAK2570095.1, KAK2548161.1, KAK2546709.1, KAK2566435.1, KAK2560484.1, KAK2550381.1, KAK2552971.1, KAK2550379.1, KAK2567729.1, KAK2550299.1, KAK2551981.1, KAK2571750.1, KAK2560840.1, KAK2560328.1, KAK2548048.1, KAK2558684.1, KAK2566808.1, KAK2547018.1, KAK2560323.1, KAK2557941.1, KAK2572006.1, KAK2555773.1, KAK2558921.1, KAK2547338.1, KAK2558521.1, KAK2572678.1, KAK2573421.1, KAK2557896.1, KAK2549467.1, KAK2562708.1, KAK2571207.1, KAK2558553.1, KAK2546759.1, KAK2548310.1, KAK2548642.1, KAK2561921.1, KAK2556445.1, KAK2557574.1, KAK2560100.1, KAK2566060.1, KAK2557257.1, KAK2556278.1, KAK2550850.1, KAK2550173.1, KAK2550172.1, KAK2565351.1, KAK2560750.1, KAK2547250.1, KAK2558381.1, KAK2557897.1, KAK2550672.1, KAK2562053.1, KAK2550875.1, KAK2555573.1, KAK2558952.1, KAK2559068.1, KAK2565462.1, KAK2549272.1, KAK2561664.1, KAK2550084.1, KAK2555577.1, KAK2560314.1, KAK2547012.1, KAK2567080.1, KAK2564607.1, KAK2558890.1, KAK2558613.1, KAK2552027.1, KAK2562709.1, KAK2561739.1, KAK2569713.1, KAK2546725.1, KAK2554962.1, KAK2561923.1, KAK2559299.1, KAK2551964.1, KAK2560816.1, KAK2547709.1, KAK2561919.1, KAK2551967.1, KAK2550073.1, KAK2558922.1, KAK2565740.1, KAK2552925.1, KAK2558567.1, KAK2568706.1, KAK2558447.1, KAK2564880.1, KAK2549630.1, KAK2549200.1, KAK2554843.1, KAK2560821.1, KAK2555927.1, KAK2547891.1, KAK2555906.1, KAK2552038.1, KAK2549158.1, KAK2547387.1, KAK2549819.1, KAK2550382.1, KAK2551401.1, KAK2562549.1
OG0000007	CFA68_HUMAN	KAK2550691.1, KAK2564519.1, KAK2547364.1, KAK2549584.1, KAK2555889.1, KAK2553585.1, KAK2555194.1, KAK2559141.1, KAK2568982.1, KAK2562501.1, KAK2559190.1, KAK2555740.1, KAK2559073.1, KAK2555776.1, KAK2564055.1, KAK2564678.1, KAK2552193.1, KAK2549140.1, KAK2555258.1, KAK2555836.1, KAK2561823.1, KAK2561758.1, KAK2554169.1, KAK2549000.1, KAK2571417.1, KAK2547372.1, KAK2554888.1, KAK2562412.1, KAK2560778.1, KAK2555207.1, KAK2547442.1, KAK2552069.1, KAK2548394.1, KAK2567631.1, KAK2568545.1, KAK2569823.1, KAK2551642.1, KAK2553693.1, KAK2567256.1, KAK2556460.1, KAK2554248.1, KAK2568540.1, KAK2558110.1, KAK2558109.1, KAK2567630.1, KAK2554247.1, KAK2556461.1, KAK2569822.1, KAK2567107.1, KAK2553689.1, KAK2554931.1, KAK2558771.1, KAK2549788.1, KAK2556975.1, KAK2548173.1, KAK2556181.1, KAK2563086.1, KAK2552057.1, KAK2552062.1, KAK2571669.1, KAK2553553.1, KAK2546801.1, KAK2550732.1, KAK2571416.1, KAK2554684.1, KAK2558129.1, KAK2565484.1, KAK2568753.1, KAK2564192.1, KAK2565615.1, KAK2549364.1, KAK2558923.1, KAK2553564.1, KAK2560769.1, KAK2558638.1, KAK2552350.1, KAK2555734.1, KAK2559458.1, KAK2566629.1, KAK2551129.1, KAK2546742.1, KAK2565102.1, KAK2550740.1, KAK2559153.1, KAK2552656.1, KAK2550735.1, KAK2564148.1, KAK2564873.1, KAK2550562.1, KAK2555827.1, KAK2549463.1, KAK2573776.1, KAK2548979.1, KAK2563416.1, KAK2568283.1, KAK2562627.1, KAK2552430.1, KAK2548531.1, KAK2548360.1, KAK2550325.1, KAK2554116.1, KAK2548487.1, KAK2549860.1, KAK2552011.1, KAK2565630.1, KAK2546688.1, KAK2551338.1, KAK2557560.1, KAK2548239.1
OG0000016	NPY2R_HUMAN, GPR83_HUMAN, NK2R_HUMAN, NK3R_HUMAN, NK1R_HUMAN, QRFPR_HUMAN, OX1R_HUMAN, OX2R_HUMAN, NPFF1_HUMAN, NPFF2_HUMAN	KAK2565130.1, KAK2565131.1, KAK2573590.1, KAK2572460.1, KAK2559581.1, KAK2559580.1, KAK2559583.1, KAK2572150.1, KAK2572365.1, KAK2572359.1, KAK2562365.1, KAK2572380.1, KAK2573133.1, KAK2572853.1, KAK2572858.1, KAK2573228.1, KAK2572993.1, KAK2558350.1, KAK2563666.1, KAK2573106.1, KAK2563854.1, KAK2572748.1, KAK2572749.1, KAK2563852.1, KAK2572952.1, KAK2572951.1, KAK2572755.1, KAK2573187.1, KAK2572750.1, KAK2572753.1, KAK2572751.1
OG0000039	DDX41_HUMAN	KAK2564525.1, KAK2546768.1, KAK2564105.1, KAK2547163.1, KAK2548376.1, KAK2547128.1, KAK2547127.1, KAK2564599.1, KAK2567583.1, KAK2560861.1, KAK2567741.1, KAK2554734.1, KAK2553217.1, KAK2557890.1, KAK2566161.1, KAK2550623.1, KAK2553605.1, KAK2546981.1, KAK2556119.1, KAK2548339.1, KAK2568130.1, KAK2556828.1, KAK2557891.1, KAK2553967.1, KAK2556568.1, KAK2553214.1, KAK2555648.1, KAK2555647.1, KAK2552963.1, KAK2569303.1, KAK2557525.1, KAK2555649.1, KAK2553225.1, KAK2546720.1, KAK2557349.1, KAK2550432.1, KAK2555182.1, KAK2550430.1, KAK2566044.1, KAK2547310.1, KAK2554148.1, KAK2554147.1, KAK2549024.1, KAK2554197.1, KAK2550433.1, KAK2549212.1, KAK2555142.1, KAK2567673.1, KAK2565308.1, KAK2567674.1, KAK2555143.1, KAK2547302.1, KAK2554905.1
OG0000046	MTR1L_HUMAN, MTR1A_HUMAN, MTR1B_HUMAN	KAK2556771.1, KAK2569787.1, KAK2569619.1, KAK2569735.1, KAK2569620.1, KAK2561990.1, KAK2551150.1, KAK2570639.1, KAK2563169.1, KAK2553351.1, KAK2563318.1, KAK2553350.1, KAK2557789.1, KAK2572679.1, KAK2559437.1, KAK2547849.1, KAK2547864.1, KAK2565858.1, KAK2566077.1, KAK2571232.1, KAK2571231.1, KAK2571236.1, KAK2554406.1, KAK2554407.1
OG0000095	GOGA2_HUMAN, GG6L7_HUMAN, GG6L2_HUMAN, GG6LZ_HUMAN, GG6L1_HUMAN, GG6LV_HUMAN, GG6LX_HUMAN, GG6LY_HUMAN, GG6L6_HUMAN, GG6L4_HUMAN, GG6L9_HUMAN, GG6LS_HUMAN, GG6LA_HUMAN, GOG6A_HUMAN, GOG6B_HUMAN, GOG6C_HUMAN, GOG6D_HUMAN, GGA2B_HUMAN, GOG8A_HUMAN, GOG8B_HUMAN, GOG8F_HUMAN, GOG8G_HUMAN, GOG8D_HUMAN, GOG8C_HUMAN, GOG8S_HUMAN, GOG8R_HUMAN, GOG8O_HUMAN, GOG8N_HUMAN, GOG8Q_HUMAN, GOG8M_HUMAN, GOG8I_HUMAN, GOG8J_HUMAN, GOG8K_HUMAN, GOG8T_HUMAN, GOG8H_HUMAN	KAK2567783.1
OG0000063	GRIA1_HUMAN, GRIA2_HUMAN, GRIA4_HUMAN, GRIA3_HUMAN, GRIK5_HUMAN, GRIK4_HUMAN, GRIK2_HUMAN, GRIK3_HUMAN, GRIK1_HUMAN	KAK2560020.1, KAK2552985.1, KAK2553015.1, KAK2553028.1, KAK2553030.1, KAK2560025.1, KAK2552984.1, KAK2559850.1, KAK2559935.1, KAK2559853.1, KAK2559934.1, KAK2559933.1, KAK2559931.1, KAK2559937.1, KAK2559852.1, KAK2574075.1, KAK2574078.1, KAK2566425.1, KAK2566473.1, KAK2566474.1, KAK2559754.1
OG0000082	CRFR1_HUMAN, CRFR2_HUMAN, CALRL_HUMAN, CALCR_HUMAN, PTH1R_HUMAN, PTH2R_HUMAN, GLP2R_HUMAN, GLP1R_HUMAN, GLR_HUMAN, GIPR_HUMAN, SCTR_HUMAN, GHRHR_HUMAN, VIPR1_HUMAN, PACR_HUMAN, VIPR2_HUMAN	KAK2572246.1, KAK2546941.1, KAK2572186.1, KAK2546929.1, KAK2546934.1, KAK2546935.1, KAK2572188.1, KAK2546943.1, KAK2572185.1, KAK2546942.1
OG0000105	MYH16_HUMAN, MYH6_HUMAN, MYH7_HUMAN, MYH13_HUMAN, MYH3_HUMAN, MYH8_HUMAN, MYH2_HUMAN, MYH4_HUMAN, MYH1_HUMAN, MYH15_HUMAN, MYH7B_HUMAN	KAK2571603.1
OG0000008	PRORY_HUMAN	KAK2547887.1, KAK2548209.1, KAK2555924.1, KAK2559450.1, KAK2555950.1, KAK2547904.1, KAK2546823.1, KAK2546667.1, KAK2547893.1, KAK2562278.1, KAK2568583.1, KAK2547534.1, KAK2571050.1, KAK2561828.1, KAK2548454.1, KAK2559291.1, KAK2555948.1, KAK2556365.1, KAK2549259.1, KAK2564037.1, KAK2573229.1, KAK2565976.1, KAK2556974.1, KAK2565834.1, KAK2547888.1, KAK2547903.1, KAK2557039.1, KAK2564085.1, KAK2547889.1, KAK2556280.1, KAK2548184.1, KAK2570152.1, KAK2551829.1, KAK2568590.1, KAK2547546.1, KAK2547537.1, KAK2567788.1, KAK2547540.1, KAK2546963.1, KAK2560668.1, KAK2552058.1, KAK2556475.1, KAK2559449.1, KAK2561655.1, KAK2549911.1, KAK2561660.1, KAK2570151.1, KAK2563844.1, KAK2549306.1, KAK2551634.1, KAK2550867.1, KAK2551127.1, KAK2558576.1, KAK2558580.1, KAK2547385.1, KAK2558581.1, KAK2549912.1, KAK2558530.1, KAK2549594.1, KAK2555536.1, KAK2552776.1, KAK2555738.1, KAK2554080.1, KAK2561770.1, KAK2548185.1, KAK2564297.1, KAK2547547.1, KAK2561769.1, KAK2547165.1, KAK2568043.1, KAK2551370.1, KAK2573322.1, KAK2554918.1, KAK2553495.1, KAK2547696.1, KAK2548103.1, KAK2573598.1, KAK2550846.1, KAK2551369.1, KAK2547124.1, KAK2559398.1, KAK2553048.1, KAK2561690.1, KAK2551541.1, KAK2551538.1, KAK2558807.1, KAK2561698.1, KAK2561691.1, KAK2559399.1, KAK2549291.1, KAK2550667.1, KAK2558646.1, KAK2565702.1, KAK2550845.1, KAK2560811.1, KAK2558604.1, KAK2558603.1, KAK2560809.1, KAK2547469.1, KAK2547384.1, KAK2558677.1, KAK2564600.1, KAK2565831.1, KAK2552782.1, KAK2560995.1, KAK2571015.1
OG0000038	HRH2_HUMAN, ADRB2_HUMAN, ADRB1_HUMAN, ADRB3_HUMAN, DRD1_HUMAN, DRD5_HUMAN	KAK2547743.1, KAK2560741.1, KAK2558445.1, KAK2558443.1, KAK2558409.1, KAK2558448.1, KAK2558449.1, KAK2573252.1, KAK2559973.1, KAK2558343.1, KAK2558508.1, KAK2558473.1, KAK2558477.1, KAK2572270.1, KAK2558472.1, KAK2570591.1, KAK2573658.1, KAK2573798.1
OG0000109	CP3A5_HUMAN, CP343_HUMAN, CP3A4_HUMAN, CP3A7_HUMAN	KAK2565310.1, KAK2565311.1, KAK2572598.1, KAK2564867.1, KAK2550634.1, KAK2550632.1, KAK2550633.1
OG0000120	K1958_HUMAN	KAK2570276.1, KAK2570275.1, KAK2564195.1, KAK2562688.1, KAK2569729.1, KAK2564194.1, KAK2548534.1, KAK2560616.1, KAK2548495.1, KAK2561787.1, KAK2557412.1, KAK2554202.1, KAK2568042.1, KAK2557411.1, KAK2548496.1, KAK2566437.1, KAK2561665.1, KAK2555969.1, KAK2565695.1, KAK2558906.1, KAK2562655.1, KAK2552436.1, KAK2554104.1, KAK2557072.1, KAK2564386.1, KAK2562522.1, KAK2548374.1, KAK2555801.1, KAK2547577.1, KAK2547579.1, KAK2552013.1
OG0000129	LIPR3_HUMAN, LIPR1_HUMAN, LIPP_HUMAN, LIPR2_HUMAN, LIPI_HUMAN, LIPH_HUMAN	KAK2556749.1, KAK2551307.1, KAK2563114.1, KAK2563113.1, KAK2563117.1, KAK2551308.1, KAK2551784.1, KAK2566340.1, KAK2560734.1, KAK2566337.1, KAK2556680.1
OG0000029	ZNF18_HUMAN, ZSA5B_HUMAN, ZSA5A_HUMAN, ZSA5D_HUMAN, ZSA5C_HUMAN, ZN446_HUMAN, ZSCA1_HUMAN, ZSC18_HUMAN, SCND1_HUMAN, ZN496_HUMAN, ZN174_HUMAN, ZN202_HUMAN, MSD7_HUMAN, SCND2_HUMAN, ZN75C_HUMAN, ZN75D_HUMAN, ZN263_HUMAN, ZN215_HUMAN, ZN213_HUMAN, ZN444_HUMAN, ZKSC2_HUMAN, ZSC29_HUMAN, ZSC32_HUMAN, ZN500_HUMAN, ZSC20_HUMAN, ZSC25_HUMAN, ZN394_HUMAN, ZSC26_HUMAN, ZKSC1_HUMAN, ZSC31_HUMAN, ZSC23_HUMAN, ZSC9_HUMAN, ZN396_HUMAN, ZNF24_HUMAN, ZSC16_HUMAN, ZKSC3_HUMAN, ZKSC4_HUMAN, ZKSC8_HUMAN, ZN397_HUMAN, ZSC12_HUMAN, ZN197_HUMAN, ZKSC7_HUMAN, ZN852_HUMAN, ZN445_HUMAN, ZN165_HUMAN, ZSC30_HUMAN, ZN232_HUMAN, ZSC21_HUMAN, ZN449_HUMAN, ZKSC5_HUMAN	KAK2572785.1
OG0000060	GALR1_HUMAN, GALR3_HUMAN, GALR2_HUMAN	KAK2573348.1, KAK2573760.1, KAK2573349.1, KAK2573761.1, KAK2560539.1, KAK2551731.1, KAK2552141.1, KAK2551672.1, KAK2551671.1, KAK2552139.1, KAK2547806.1, KAK2551867.1, KAK2548644.1, KAK2572782.1, KAK2573180.1, KAK2557206.1, KAK2572655.1, KAK2573181.1, KAK2565199.1
OG0000077	LRC31_HUMAN, RINI_HUMAN, NLRP6_HUMAN, NLRP3_HUMAN, NAL12_HUMAN, NAL10_HUMAN, NLRP1_HUMAN, CARD8_HUMAN, NALP7_HUMAN, NALP2_HUMAN, PYDC2_HUMAN, PYDC4_HUMAN, NALP8_HUMAN, NALP4_HUMAN, NAL11_HUMAN, NLRP9_HUMAN, NALP5_HUMAN, NAL14_HUMAN, NAL13_HUMAN	KAK2565404.1
OG0000056	IF2P_HUMAN	KAK2559323.1, KAK2548478.1, KAK2557962.1, KAK2558805.1, KAK2554342.1, KAK2553126.1, KAK2571534.1, KAK2564101.1, KAK2562608.1, KAK2552349.1, KAK2547484.1, KAK2562261.1, KAK2547359.1, KAK2552080.1, KAK2547563.1, KAK2549134.1, KAK2551935.1, KAK2564644.1, KAK2552227.1, KAK2551976.1, KAK2565726.1, KAK2552780.1, KAK2568527.1, KAK2550374.1, KAK2546993.1, KAK2552428.1, KAK2552226.1, KAK2568729.1, KAK2556264.1, KAK2562262.1, KAK2561775.1, KAK2559513.1, KAK2555215.1, KAK2561860.1, KAK2546849.1, KAK2554022.1, KAK2550706.1, KAK2561861.1, KAK2558875.1, KAK2548079.1, KAK2558863.1, KAK2560671.1, KAK2549593.1, KAK2572409.1, KAK2563250.1
OG0000084	NAIF1_HUMAN	KAK2562816.1, KAK2563829.1, KAK2570334.1, KAK2565617.1, KAK2551329.1, KAK2551414.1, KAK2548471.1, KAK2566331.1, KAK2571631.1, KAK2567711.1, KAK2550663.1, KAK2551560.1, KAK2560833.1, KAK2570328.1, KAK2548517.1, KAK2549353.1, KAK2546829.1, KAK2547901.1, KAK2553678.1, KAK2562289.1, KAK2550051.1, KAK2553682.1, KAK2552556.1, KAK2547505.1, KAK2552091.1, KAK2561936.1, KAK2562905.1, KAK2558750.1, KAK2567420.1, KAK2548527.1, KAK2548526.1, KAK2558573.1, KAK2554296.1, KAK2550662.1, KAK2555166.1
OG0000106	H2B1A_HUMAN, H2B1M_HUMAN, H2B1D_HUMAN, H2B1C_HUMAN, H2B2C_HUMAN, H2B2D_HUMAN, H2B2E_HUMAN, H2B1J_HUMAN, H2B1K_HUMAN, H2BFS_HUMAN, H2B1O_HUMAN, H2B1H_HUMAN, H2B2F_HUMAN, H2B1B_HUMAN, H2B1N_HUMAN, H2B1L_HUMAN, H2B3B_HUMAN	KAK2546642.1
OG0000128	MA13P_HUMAN, MAGC3_HUMAN, MAGC2_HUMAN, MAGC1_HUMAN, MAGAA_HUMAN, MAGAB_HUMAN, MAGA9_HUMAN, MAGA8_HUMAN, MAGA3_HUMAN, MAGA6_HUMAN, MAGA2_HUMAN, MAGAC_HUMAN, MAGA5_HUMAN, MAGA1_HUMAN, MAGA4_HUMAN, MAGBG_HUMAN, MAGBA_HUMAN, MAGB3_HUMAN, MAGB5_HUMAN, MAGB4_HUMAN, MAGB1_HUMAN, MAGB2_HUMAN, MAGBH_HUMAN, MAB6B_HUMAN, MAGB6_HUMAN, MAGBI_HUMAN, MAGF1_HUMAN, NSE3_HUMAN	KAK2548674.1, KAK2557806.1
OG0000049	GBP5_HUMAN, GBP1_HUMAN, GBP3_HUMAN, GBP2_HUMAN, GBP6_HUMAN, GBP4_HUMAN, GBP7_HUMAN	KAK2566431.1, KAK2568135.1, KAK2568386.1, KAK2568141.1, KAK2568392.1, KAK2568136.1, KAK2568137.1, KAK2546635.1, KAK2563382.1, KAK2547246.1, KAK2547245.1, KAK2562547.1, KAK2547431.1, KAK2548543.1, KAK2568830.1, KAK2548037.1, KAK2560428.1, KAK2555846.1, KAK2551694.1, KAK2567110.1, KAK2548036.1, KAK2549449.1, KAK2565693.1, KAK2564999.1, KAK2568139.1, KAK2564477.1, KAK2567766.1, KAK2555413.1, KAK2552514.1, KAK2565000.1, KAK2559671.1, KAK2547621.1, KAK2552518.1, KAK2552520.1
OG0000087	TLR2_HUMAN, TLR10_HUMAN, TLR6_HUMAN, TLR1_HUMAN	KAK2551070.1, KAK2569026.1, KAK2569156.1, KAK2569480.1, KAK2569481.1, KAK2560239.1, KAK2560250.1, KAK2570477.1, KAK2570329.1, KAK2570492.1, KAK2547027.1, KAK2549056.1, KAK2570079.1, KAK2553735.1, KAK2561390.1, KAK2561257.1, KAK2561222.1, KAK2561259.1, KAK2561224.1, KAK2561254.1, KAK2561218.1, KAK2561225.1
OG0000113	JDP2_HUMAN, ATF3_HUMAN, FOSB_HUMAN, FOS_HUMAN, FOSL1_HUMAN, FOSL2_HUMAN	KAK2568712.1, KAK2568716.1, KAK2568714.1
OG0000138	ACSM3_HUMAN, ACSM5_HUMAN, ACSM4_HUMAN, ACS2A_HUMAN, ACS2B_HUMAN, ACSM1_HUMAN, NPIA2_HUMAN, NPIA1_HUMAN, NPIA7_HUMAN, NPIA8_HUMAN, NPIA5_HUMAN, NPIA6_HUMAN, NPIA9_HUMAN, NPIA3_HUMAN, NPIB8_HUMAN, NPB15_HUMAN, NPIB7_HUMAN, NPIB6_HUMAN, NPIB9_HUMAN, NPIB2_HUMAN, NPB11_HUMAN, NPIB5_HUMAN, NPIB3_HUMAN, NPIB4_HUMAN, NPB13_HUMAN, NPB12_HUMAN	KAK2567130.1
OG0000078	CLC4G_HUMAN	KAK2556342.1, KAK2562543.1, KAK2556325.1, KAK2547139.1, KAK2571944.1, KAK2556326.1, KAK2560026.1, KAK2556346.1, KAK2556349.1, KAK2556331.1, KAK2556402.1, KAK2551066.1, KAK2546638.1, KAK2567591.1, KAK2551933.1, KAK2546702.1, KAK2547232.1, KAK2547422.1, KAK2547211.1, KAK2546953.1, KAK2547215.1, KAK2547218.1, KAK2547234.1, KAK2547212.1, KAK2547229.1, KAK2572109.1, KAK2568523.1, KAK2572732.1, KAK2572733.1, KAK2562131.1, KAK2564981.1
OG0000089	CGT_HUMAN, UDB15_HUMAN, UDB17_HUMAN, UD2B4_HUMAN, UD2B7_HUMAN, UDB10_HUMAN, UDB11_HUMAN, UDB28_HUMAN, UD2A1_HUMAN, UD2A2_HUMAN, UD2A3_HUMAN, UD11_HUMAN, UD13_HUMAN, UD14_HUMAN, UD15_HUMAN, UD16_HUMAN, UD19_HUMAN, UD18_HUMAN, UD110_HUMAN, UD17_HUMAN	KAK2554246.1, KAK2554254.1, KAK2562005.1, KAK2561518.1, KAK2566480.1
OG0000098	RPA43_HUMAN	KAK2557066.1, KAK2559901.1, KAK2559895.1, KAK2559898.1, KAK2559899.1, KAK2553413.1, KAK2559929.1, KAK2559897.1, KAK2553475.1, KAK2559807.1, KAK2559808.1, KAK2559809.1, KAK2559810.1, KAK2559812.1, KAK2560289.1, KAK2560293.1, KAK2560299.1, KAK2560288.1, KAK2546716.1, KAK2553785.1, KAK2560300.1, KAK2547025.1
OG0000108	MFAP4_HUMAN, FCN1_HUMAN, FCN2_HUMAN	KAK2556160.1, KAK2551566.1, KAK2553805.1, KAK2559185.1, KAK2565557.1, KAK2569546.1, KAK2569547.1, KAK2547835.1, KAK2547138.1, KAK2547839.1, KAK2547828.1, KAK2547836.1, KAK2569549.1, KAK2569606.1, KAK2569599.1, KAK2552859.1, KAK2559022.1, KAK2574277.1
OG0000139	NOTC1_HUMAN, NOTC3_HUMAN, NOTC2_HUMAN, NT2NA_HUMAN, NT2NC_HUMAN, NT2NB_HUMAN, NT2NR_HUMAN, NBPFP_HUMAN, NBPF9_HUMAN, NBPFF_HUMAN, NBPFJ_HUMAN, NBPFK_HUMAN, NBPFE_HUMAN, NBPFA_HUMAN, NBPF8_HUMAN, NBPF1_HUMAN, NBPFC_HUMAN, NBPFB_HUMAN, NBPF3_HUMAN, NBPF7_HUMAN, NBPF5_HUMAN, NBPF4_HUMAN, NBPF6_HUMAN, MYOME_HUMAN	KAK2568112.1, KAK2570741.1
OG0000009	DZIP3_HUMAN	KAK2564457.1, KAK2564670.1, KAK2557587.1, KAK2546917.1, KAK2550810.1, KAK2546913.1, KAK2557510.1, KAK2550808.1, KAK2557489.1, KAK2546687.1, KAK2551351.1, KAK2568676.1, KAK2547564.1, KAK2566396.1, KAK2546645.1, KAK2557492.1, KAK2557561.1, KAK2566769.1, KAK2557511.1, KAK2560414.1, KAK2568942.1, KAK2561932.1, KAK2550807.1, KAK2557542.1, KAK2557559.1, KAK2560914.1, KAK2558039.1, KAK2553680.1, KAK2553679.1, KAK2553685.1, KAK2553681.1, KAK2553732.1, KAK2547017.1, KAK2559922.1, KAK2562527.1, KAK2573986.1, KAK2562610.1, KAK2573985.1, KAK2570037.1, KAK2563804.1, KAK2556546.1, KAK2563952.1, KAK2546693.1
OG0000054	MOT8_HUMAN, MOT10_HUMAN, MOT11_HUMAN, MOT13_HUMAN, MOT6_HUMAN, MOT1_HUMAN, MOT2_HUMAN, MOT3_HUMAN, MOT4_HUMAN	KAK2554269.1, KAK2571085.1, KAK2566404.1, KAK2573689.1, KAK2570783.1, KAK2573545.1, KAK2573547.1, KAK2564918.1, KAK2569119.1, KAK2566788.1, KAK2555499.1, KAK2550585.1, KAK2554874.1, KAK2548732.1, KAK2552957.1
OG0000102	ZN862_HUMAN	KAK2556242.1, KAK2549954.1, KAK2555870.1, KAK2553006.1, KAK2551679.1, KAK2548999.1, KAK2556233.1, KAK2556190.1, KAK2556189.1, KAK2556188.1, KAK2552847.1, KAK2558938.1, KAK2559055.1, KAK2551422.1, KAK2565664.1, KAK2562431.1, KAK2565665.1, KAK2565663.1, KAK2568943.1, KAK2561750.1, KAK2555882.1, KAK2554058.1, KAK2555881.1, KAK2559818.1, KAK2564106.1, KAK2551415.1, KAK2557555.1, KAK2548097.1, KAK2558920.1, KAK2547535.1, KAK2553582.1, KAK2548080.1, KAK2550070.1, KAK2553589.1, KAK2561662.1, KAK2556241.1
